{
  "$schema": "https://json-schema.org/draft/2020-12/schema",
  "$id": "visual-response/config.schema.json",
  "title": "Visual response configuration layer",
  "description": "Any layer (defaults, harness profile `config`, user config, project config) uses this shape. Every key is optional; later layers override earlier ones key by key.",
  "type": "object",
  "additionalProperties": false,
  "properties": {
    "$schema": {"type": "string"},
    "theme": {"description": "Theme pack name, a path to a theme.json or pack folder, or an inline theme object.", "type": ["string", "object"]},
    "themeFallback": {"type": "string"},
    "appearance": {"enum": ["light", "dark", "system", "host", null]},
    "harness": {"type": "string", "pattern": "^[a-z0-9][a-z0-9-]*$"},
    "views": {
      "type": "object",
      "additionalProperties": false,
      "properties": {
        "enabled": {"type": "array", "uniqueItems": true, "items": {"enum": ["table", "cards", "form", "kanban", "flow"]}},
        "motion": {"type": "boolean"}
      }
    },
    "placement": {
      "type": "object",
      "additionalProperties": false,
      "properties": {
        "viewport": {
          "type": "object",
          "additionalProperties": false,
          "properties": {"width": {"type": "integer", "minimum": 320}, "height": {"type": "integer", "minimum": 240}}
        },
        "heightBudget": {
          "type": "object",
          "additionalProperties": false,
          "properties": {"maxPx": {"type": "integer", "minimum": 120}, "fraction": {"type": "number", "exclusiveMinimum": 0, "maximum": 1}}
        },
        "inlineLimits": {
          "type": "object",
          "additionalProperties": false,
          "properties": {
            "table": {"anyOf": [{"const": false}, {"type": "object", "additionalProperties": false, "properties": {"rows": {"type": "integer", "minimum": 0}, "columns": {"type": "integer", "minimum": 0}}}]},
            "cards": {"anyOf": [{"const": false}, {"type": "object", "additionalProperties": false, "properties": {"items": {"type": "integer", "minimum": 0}}}]},
            "form": {"anyOf": [{"const": false}, {"type": "object", "additionalProperties": false, "properties": {"units": {"type": "integer", "minimum": 0}}}]},
            "flow": {"anyOf": [{"const": false}, {"type": "object", "additionalProperties": false, "properties": {"nodes": {"type": "integer", "minimum": 0}}}]},
            "kanban": {"anyOf": [{"const": false}, {"type": "object", "additionalProperties": false, "properties": {"items": {"type": "integer", "minimum": 0}}}]},
            "motion": {"type": "boolean"}
          }
        },
        "maxInlineBytes": {"type": "integer", "minimum": 1000},
        "maxSpecBytes": {"type": ["integer", "null"], "minimum": 200}
      }
    },
    "delivery": {
      "type": "object",
      "additionalProperties": false,
      "properties": {
        "mode": {"enum": ["embed", "url", "module"]},
        "rendererUrl": {"type": ["string", "null"], "pattern": "^https://"},
        "repository": {"description": "Public GitHub \"owner/name\" this skill is released from. When rendererUrl is null, the renderer loads from jsDelivr at the release tag (tagPrefix + bundle version).", "type": ["string", "null"], "pattern": "^[A-Za-z0-9_.-]+/[A-Za-z0-9_.-]+$"},
        "repositoryPath": {"description": "This skill's folder inside the repository.", "type": "string"},
        "tagPrefix": {"type": "string"},
        "integrity": {"description": "\"manifest\" computes SRI from the local bundle, a literal sha384-… value pins one, null omits it.", "type": ["string", "null"]}
      }
    },
    "output": {
      "type": "object",
      "additionalProperties": false,
      "properties": {
        "inline": {"enum": ["fragment", "document", "artifact-page"]},
        "standalone": {"enum": ["fragment", "document", "artifact-page"]}
      }
    },
    "feedback": {
      "type": "object",
      "additionalProperties": false,
      "properties": {
        "defaultPrompt": {"type": "string"},
        "formPrompt": {"type": "string"},
        "messageFormat": {"description": "How Send to chat writes the message: pretty JSON, one-line JSON, or a readable summary line followed by one-line JSON.", "enum": ["json", "compact", "summary"]}
      }
    },
    "copy": {"description": "User-facing strings. Partial objects are merged over the defaults.", "type": "object"}
  }
}
